pmid,title,pub_year,journal,authors,abstract,url,abstract_ja
40515934,The Emergence of Applied Artificial Intelligence in the Realm of Value Based Musculoskeletal Care.,2025,Current reviews in musculoskeletal medicine,"Hunter Jefferson, Dentino Philippe, Jayakumar Prakash","To establish the state-of-the-art in applied artificial intelligence (A.I) related to value-based musculoskeletal health care. We performed a literature review of A.I applications in orthopaedics and contextualized these studies based on their alignment with allocative value, technical value, and personal value. We synthesized our findings using descriptive analysis and the Gartner Hype Cycle. 82% of research activity involving A.I and its applications in musculoskeletal care is dominantly focused on technical value, which can be divided into three main sub-groups: imaging and diagnostics, prognostic outcomes and risk factors, and A.I integration within medical devices and care pathways. A.I advancing personal value (18% of studies) is rapidly gaining traction. Relatively few studies (< 1%) focused on allocative value. Emerging applications of A.I in orthopaedics providing 'technical value' include machine learning algorithms for predicting risk and prognosis, diagnostic computer vision algorithms, models advancing surgical robotics; 'personal value' include ambient listening technology, A.I scribes, triage of clinical messages, patient engagement via LLM chatbots, pre-charting applications; and emotional intelligence. Application of these technologies to Gartner's Hype Cycle suggests big data analytics and robotic surgery applications are approaching the plateau of productivity while multiagent / autonomous systems, emotional intelligence, and AI-enabled decision intelligence serve as innovation triggers but are in their infancy. A.I offers the opportunity to improve medical diagnosis, processes, practices and patient experiences and outcomes within musculoskeletal care delivery. While applications enhancing technical value and personal value are being actively researched and rapidly developed in the digital health industry, studies on how A.I provides value through equitable and fair allocation of resources at a population level should be promoted.",https://pubmed.ncbi.nlm.nih.gov/40515934/,価値ベースの筋骨格ヘルスケアに関連する適用された人工知能（A.I）の最先端を確立する。整形外科のA.Iアプリケーションの文献レビューを実行し、配分価値、技術的価値、および個人的価値との調整に基づいて、これらの研究を文脈化しました。記述分析とGartnerの誇大広告サイクルを使用して、調査結果を合成しました。A.Iに関与する研究活動の82％と筋骨格ケアへのその応用は、技術的価値に支配的に焦点を当てており、3つの主要なサブグループに分けることができます：イメージングと診断、予後的結果とリスク要因、および医療機器とケア経路内のA.I統合。A.I個人的価値（研究の18％）を前進させていることは、急速に牽引力を獲得しています。比較的少数の研究（<1％）が配分値に焦点を合わせました。「技術的価値」を提供する整形外科におけるA.Iの新たなアプリケーションには、リスクと予後を予測するための機械学習アルゴリズム、診断コンピュータービジョンアルゴリズム、外科的ロボット工学の前進モデルが含まれます。「個人的な価値」には、アンビエントリスニングテクノロジー、A.I筆記者、臨床メッセージのトリアージ、LLMチャットボットを介した患者の関与、事前に作成するアプリケーションが含まれます。と感情的な知性。これらの技術をガートナーの誇大広告サイクルに適用することは、ビッグデータ分析とロボット手術アプリケーションが生産性の高原に近づいていることを示唆していますが、マルチエージェント /自律システム、感情的知能、およびAI対応の意思決定インテリジェンスはイノベーショントリガーとして機能しますが、幼少期です。A.Iは、筋骨格ケアの提供における医療診断、プロセス、実践、患者の経験、および結果を改善する機会を提供します。技術的価値と個人的価値を高めるアプリケーションは、デジタルヘルス業界で積極的に研究され、急速に開発されていますが、A.Iは人口レベルでの公平かつ公正なリソースの割り当てを通じて価値を提供する方法についての研究を促進する必要があります。
40708759,Impact of prompting on large language model performance: ChatGPT-4 performance on the 2023 hand surgery self-assessment examination.,2025,Journal of hand and microsurgery,"Fiedler Benjamin, Barron Olivia A, Hauck Jeffrey, Scioscia Jacob, Phillips Todd, Ahmed Adil S, Mitchell Scott","Large language models (LLMs) such as ChatGPT are artificial intelligence programs designed to interpret and respond to text based input These programs can improve output based on prompting and tailored prompt engineering. Multiple studies have assessed the ability of various LLMs to perform on medical exams at different levels of training. The newest version of ChatGPT, GPT-4, allows image recognition which is relevant for many questions on orthopedic surgery exams. Performance of GPT-4, and the potential for LLMs to learn from prior exams remains unclear. The present study analyzed ChatGPT-4 performance on the 2023 hand surgery Maintenance of Certification (MOC) Self-Assessment Examination (SAE) before and after prompting with 5 previous versions of the test. It was hypothesized that GPT-4 would pass the exam and improve performance after prompting. GPT-4 was tested with all text and image-based questions from the 2023 hand surgery SAE. Video-based questions were excluded. GPT-4 was then provided with questions, answers, and explanations from 5 previous SAEs from 2014 to 2020 and retested on the 2023 SAE text and imaging questions. Responses from GPT-4 on prompted and unprompted tests were recorded and compared. Both prompted and unprompted versions of ChatGPT-4 exceeded SAE exam passing requirement of >50 % correct response rate. GPT-4 answered 67 % of all questions correctly unprompted and 71 % of all questions correctly after prompting (p = 0.51). Sub-analysis demonstrated GPT-4 answered 66 % of image-based questions correctly after prompting, compared to 56 % before prompting (p = 0.25). GPT-4 answered 75 % of text only questions correctly before prompting and 74 % correctly after prompting (p = 1.0). Fischer's exact test on total questions, image only, and text only showed no statistically significant differences between prompted and unprompted versions of GPT-4. GPT-4 demonstrated the ability to analyze orthopedic information, answer specialty-specific questions, and exceed the passing threshold of 50 % on the 2023 Hand Surgery Self-Assessment Exam. However, prompting GPT-4 with previous SAEs did not statistically significantly improve performance. With continued advancements in AI and deep learning, large language models may someday become resources in test simulation and knowledge checks in the realm of hand surgery.",https://pubmed.ncbi.nlm.nih.gov/40708759/,CHATGPTなどの大規模な言語モデル（LLM）は、テキストベースの入力を解釈して応答するように設計された人工知能プログラムです。これらのプログラムは、プロンプトとカスタマイズされたプロンプトエンジニアリングに基づいて出力を改善できます。複数の研究により、さまざまなLLMがさまざまなレベルのトレーニングで健康診断で実行する能力が評価されています。CHATGPTの最新バージョンであるGPT-4は、整形外科試験に関する多くの質問に関連する画像認識を可能にします。GPT-4のパフォーマンス、およびLLMSが以前の試験から学習する可能性は不明のままです。本研究では、5つの以前のバージョンのテストで促進する前後の2023年の手術維持認定（MOC）自己評価試験（SAE）のCHATGPT-4パフォーマンスを分析しました。GPT-4が試験に合格し、プロンプト後にパフォーマンスを改善すると仮定されました。GPT-4は、2023年の手術SAEからのすべてのテキストおよび画像ベースの質問でテストされました。ビデオベースの質問は除外されました。GPT-4には、2014年から2020年までの5つの以前のSAEからの質問、回答、説明が提供され、2023年のSAEテキストとイメージングの質問に再テストされました。プロンプトされたテストと未施設のテストに対するGPT-4からの応答が記録され、比較されました。CHATGPT-4のプロンプト化されていないバージョンと非採用バージョンの両方が、50％を超える正しい回答率のSAE試験の合格要件を超えました。GPT-4は、すべての質問の67％に、プロンプトをプロンプトした後に正しく採用されていない67％とすべての質問の71％に正しく答えました（p = 0.51）。サブ分析により、GPT-4は、プロンプト後の56％と比較して、プロンプト後に画像ベースの質問の66％に正しく答えました（p = 0.25）。GPT-4は、テキストの75％に、プロンプトを入力する前に正しく質問のみ、プロンプト（p = 1.0）後に74％に正しく質問しました。総質問、画像のみ、およびテキストに関するフィッシャーの正確なテストは、GPT-4のプロンプトバージョンと非プロンプトバージョンの間に統計的に有意な違いのみを示しませんでした。GPT-4は、整形外科情報を分析し、専門固有の質問に答え、2023年の手術自己評価試験で50％の通過しきい値を超える能力を実証しました。ただし、以前のSAEでGPT-4を促すことで、統計的にパフォーマンスが大幅に向上しませんでした。AIでの継続的な進歩と深い学習により、大規模な言語モデルは、いつかテストシミュレーションのリソースになり、手術の領域での知識チェックになる可能性があります。
40683982,Evaluation of a retrieval-augmented generation system using a Japanese Institutional Nuclear Medicine Manual and large language model-automated scoring.,2025,Radiological physics and technology,"Fukui Yusuke, Kawata Yuhei, Kobashi Kazumasa, Nagatani Yukihiro, Iguchi Harumi","Recent advances in large language models (LLMs) enable domain-specific question answering using external knowledge. However, addressing information that is not included in training data remains a challenge, particularly in nuclear medicine, where examination protocols are frequently updated and vary across institutions. In this study, we developed a retrieval-augmented generation (RAG) system using 40 internal manuals from a single Japanese hospital, each corresponding to a different examination in nuclear medicine. These institution-specific documents were segmented and indexed using a hybrid retrieval strategy combining dense vector search (text-embedding-3-small) and sparse keyword search (BM25). GPT-3.5 and GPT-4o were used with the OpenAI application programming interface (API) for response generation. The quality of the generated answers was assessed using a four-point Likert scale by three certified radiological technologists, of which one held an additional certification in nuclear medicine and another held an additional certification in medical physics. Automated evaluation was conducted using RAGAS metrics, including factual correctness and context recall. The GPT-4o model combined with hybrid retrieval achieved the highest performance, as per expert evaluations. Although traditional string-based metrics such as ROUGE and the Levenshtein distance poorly align with human ratings, RAGAS provided consistent rankings across system configurations, despite showing only a modest correlation with manual scores. These findings demonstrate that integrating examination-specific institutional manuals into RAG frameworks can effectively support domain-specific question answering in nuclear medicine. Moreover, LLM-based evaluation methods such as RAGAS may serve as practical tools to complement expert reviews in developing healthcare-oriented artificial intelligence systems.",https://pubmed.ncbi.nlm.nih.gov/40683982/,大規模な言語モデル（LLMS）の最近の進歩により、外部の知識を使用したドメイン固有の質問応答が可能になります。ただし、トレーニングデータに含まれていない情報への対処は、特に核医学では課題のままです。核医学では、検査プロトコルが頻繁に更新され、機関によって異なります。この研究では、核医学の異なる検査に対応する、単一の日本の病院から40の内部マニュアルを使用して、検索された生成（RAG）システムを開発しました。これらの機関固有のドキュメントは、高密度ベクトル検索（Text-rembedding-3-Small）とスパースキーワード検索（BM25）を組み合わせたハイブリッド検索戦略を使用してセグメント化およびインデックス作成されました。GPT-3.5およびGPT-4Oは、応答生成のためにOpenAIアプリケーションプログラミングインターフェイス（API）で使用されました。生成された回答の品質は、3人の認定放射線技術者による4点のリッカートスケールを使用して評価され、1人は核医学の追加認定を行い、もう1人は医学物理学の追加認定を保持しました。自動評価は、事実上の正確性とコンテキストリコールを含むRagasメトリックを使用して実施されました。GPT-4Oモデルとハイブリッド検索を組み合わせたものは、専門家の評価に従って、最高のパフォーマンスを達成しました。RougeやLevenshtein距離などの従来の文字列ベースのメトリックは、人間の評価とは不十分ですが、Ragasは、手動スコアとの控えめな相関のみを示しているにもかかわらず、システム構成全体で一貫したランキングを提供しました。これらの調査結果は、試験固有の組織マニュアルをRAGフレームワークに統合することで、核医学におけるドメイン固有の質問応答を効果的にサポートできることを示しています。さらに、RAGASなどのLLMベースの評価方法は、医療指向の人工知能システムの開発における専門家のレビューを補完するための実用的なツールとして機能する可能性があります。
40677929,Development and Evaluation of an Artificial Intelligence-Powered Surgical Oral Examination Simulator: A Pilot Study.,2025,Mayo Clinic proceedings. Digital health,"Rao Arya S, Prasad Siona, Lee Richard S, Farrell Susan, McKinley Sophia, Succi Marc D","To develop and validate an artificial intelligence-powered platform that simulates surgical oral examinations, addressing the limitations of traditional faculty-led sessions. This cross-sectional study, conducted from June 1, 2024, through December 1, 2024, comprised technical validation and educational assessment of a novel large language model (LLM)-based surgical education tool (surgery oral examination large language model [SOE-LLM]). The study involved 12 surgical clerkship students completing their core rotation at a major academic medical center. The SOE-LLM, using MIMIC-IV-derived surgical cases (acute appendicitis and pancreatitis), was implemented to simulate oral examinations. Technical validation assessed performance across 8 domains: case presentation accuracy, physical examination findings, historical detail preservation, laboratory data reporting, imaging interpretation, management decisions, and recognition of contraindicated interventions. Educational utility was evaluated using a 5-point Likert scale. Technical validation showed the SOE-LLM's ability to function as a consistent oral examiner. The model accurately guided students through case presentations, responded to diagnostic questions, and provided clinically sound responses based on MIMIC-IV cases. When tested with standardized prompts, it maintained examination fidelity, requiring proper diagnostic reasoning and differentiating operative versus medical management. Student evaluations highlighted the platform's value as an examination preparation tool (mean, 4.250; SEM, 0.1794) and its ability to create a low-stakes environment for high-stakes decision practice (mean, 4.833; SEM, 0.1124). The SOE-LLM shows potential as a valuable tool for surgical education, offering a consistent and accessible platform for simulating oral examinations.",https://pubmed.ncbi.nlm.nih.gov/40677929/,従来の教員主導のセッションの限界に対処するために、外科的経口検査をシミュレートする人工知能駆動のプラットフォームを開発および検証する。2024年6月1日から2024年12月1日までに実施されたこの横断的研究は、新しい大規模言語モデル（LLM）ベースの外科教育ツール（手術口頭検査大規模言語モデル[SOE-LLM]）の技術的検証と教育評価で構成されました。この研究には、主要なアカデミックメディカルセンターでコアローテーションを完了する12人の外科書記官が参加しました。SOE-LLMは、模倣IV由来の外科的症例（急性虫垂炎および膵炎）を使用して、口腔検査をシミュレートするために実装されました。技術的検証では、8つのドメインでパフォーマンスを評価しました：ケースプレゼンテーションの精度、身体検査の調査結果、歴史的詳細保存、実験室データの報告、イメージング解釈、管理の決定、および禁忌介入の認識。教育ユーティリティは、5ポイントのリッカートスケールを使用して評価されました。技術的検証により、SOE-LLMが一貫した口腔診察室として機能する能力が示されました。このモデルは、ケースプレゼンテーションを通じて学生を正確に導き、診断の質問に応答し、模倣IVの症例に基づいて臨床的に健全な反応を提供しました。標準化されたプロンプトでテストされた場合、適切な診断の推論を必要とし、手術と医療管理を区別する必要がありました。学生の評価により、プラットフォームの価値は、試験準備ツール（平均、4.250; SEM、0.1794）としての価値を強調しました。また、ハイステークスの決定実践のために低ステーク環境を作成する能力（平均、4.833; SEM、0.1124）を強調しました。SOE-LLMは、外科教育のための貴重なツールとしての可能性を示しており、口頭試験をシミュレートするための一貫したアクセス可能なプラットフォームを提供します。
40669284,Refining LLMs outputs with iterative consensus ensemble (ICE).,2025,Computers in biology and medicine,"Omar Mahmud, Glicksberg Benjamin S, Nadkarni Girish N, Klang Eyal","Large language models (LLMs) show promising accuracy on challenging tasks, including medical question answering. Yet, direct gains from model upgrades can plateau, and reliability issues persist. We introduce Iterative Consensus Ensemble (ICE), a proof-of-concept framework that refines answers through iterative reasoning and feedback among multiple LLMs. This ensemble method encourages diverse models to scrutinize each other's outputs, converging on a consensus solution. We tested ICE on four different datasets. These included over 4000 multiple-choice questions drawn from a newly curated primary care exam set, established medical benchmarks, and a PhD-level reasoning dataset. Compared to initial single-model attempts, ICE improved final overall accuracy by up to 27 %. It reached accuracies 81 % in medical subsets and 72 % in multi-domain tasks from initial scores of about 72 % and 60 %, respectively. In a particularly challenging PhD-level reasoning benchmark (GPQA-diamond), ICE raised performance from 46.9 % initially to 68.2 % at the final consensus, a relative gain exceeding 45 %. On a specialized family medicine dataset, ICE's results were statistically indistinguishable from those of a complex reasoning model (O1-preview), despite O1's higher cost and computational demands. Additional analyses showed that ICE's iterative consensus remained effective under different prompting styles. Our proposed framework leverages standard LLMs and repeated prompting, requiring no specialized reward models or intricate token-level fusion. These findings show that iterative collaboration can transform LLM ensembles into more reliable, cost-efficient solvers, advancing performance in medical and general reasoning domains. Future refinements may integrate chain-of-thought steps or specialist models, extending this approach to more complex challenges as LLMs and benchmarks continue to evolve.",https://pubmed.ncbi.nlm.nih.gov/40669284/,大規模な言語モデル（LLMS）は、医療質問の回答を含む、挑戦的なタスクの有望な正確性を示しています。しかし、モデルのアップグレードからの直接的な利益はプラトーになる可能性があり、信頼性の問題は持続します。複数のLLM間の反復推論とフィードバックを通じて回答を改良する概念実証フレームワークである反復コンセンサスアンサンブル（ICE）を紹介します。このアンサンブル方法は、多様なモデルが互いの出力を精査することを促進し、コンセンサスソリューションに収束します。4つの異なるデータセットでICEをテストしました。これらには、新たにキュレーションされたプライマリケア試験セット、確立された医療ベンチマーク、およびPHDレベルの推論データセットから描かれた4000以上の複数選択の質問が含まれていました。初期のシングルモデルの試みと比較して、ICEは最終的な全体的な精度を最大27％改善しました。医療サブセットでは、それぞれ約72％と60％の初期スコアからマルチドメインタスクで72％に達しました。特に挑戦的なPHDレベルの推論ベンチマーク（GPQA-ダイアモンド）では、ICEは最終コンセンサスで最初は46.9％から68.2％にパフォーマンスを上げました。専門化された家庭医学データセットでは、O1のより高いコストと計算の要求にもかかわらず、ICEの結果は複雑な推論モデル（O1-Preview）の結果と統計的に区別できませんでした。追加の分析により、ICEの反復コンセンサスは、さまざまなプロンプトスタイルの下で効果的なままであることが示されました。提案されたフレームワークは、標準のLLMと繰り返しプロンプトを活用し、専門的な報酬モデルや複雑なトークンレベルの融合を必要としません。これらの調査結果は、反復的なコラボレーションがLLMアンサンブルをより信頼性の高い費用効率の高いソルバーに変換し、医療および一般的な推論ドメインのパフォーマンスを進めることができることを示しています。将来の改良により、チェーンのステップまたは専門モデルが統合され、LLMSとベンチマークが進化し続けるにつれて、このアプローチをより複雑な課題に拡張することができます。
