pmid,title,pub_year,journal,authors,abstract,url,abstract_ja
40581100,MDD-LLM: Towards accuracy large language models for major depressive disorder diagnosis.,2025,Journal of affective disorders,"Sha Yuyang, Pan Hongxin, Xu Wei, Meng Weiyu, Luo Gang, Du Xinyu, Zhai Xiaobing, Tong Henry H Y, Shi Caijuan, Li Kefeng","Major depressive disorder (MDD) impacts >300 million individuals worldwide, highlighting a significant public health issue. However, the uneven distribution of medical resources and the complexity of diagnostic methods have resulted in inadequate attention to this disorder in numerous countries and regions. This paper introduces a high-performance MDD diagnosis tool named MDD-LLM, an AI-driven framework that utilizes fine-tuned large language models (LLMs) and extensive real-world samples to tackle challenges in MDD diagnosis. Specifically, we select 274,348 individual records from the UK Biobank cohort and design three tabular data transformation methods to create a large corpus for training and evaluating the proposed method. To illustrate the advantages of MDD-LLM, we perform comprehensive experiments and provide several comparative analyses against existing model-based solutions across multiple evaluation metrics. Experimental results show that MDD-LLM (70B) achieves an accuracy of 0.8378 and an AUC of 0.8919 (95 % CI: 0.8799-0.9040), significantly outperforming existing machine and deep learning frameworks for MDD diagnosis. Given the limited exploration of LLMs in MDD diagnosis, we examine numerous factors that may influence the performance of our proposed method, including tabular data transformation techniques and different fine-tuning strategies. Furthermore, we also analyze the model's interpretability, requiring the MDD-LLM to explain its predictions and provide corresponding reasons. This paper investigates the application of LLMs and large-scale training samples for diagnosing MDD. The findings indicate that LLMs-driven schemes offer significant potential for accuracy, robustness, and interpretability in MDD diagnosis compared to traditional model-based solutions.",https://pubmed.ncbi.nlm.nih.gov/40581100/,"主要な抑うつ障害（MDD）は、世界中の3億人以上の個人に影響を与え、重大な公衆衛生問題を強調しています。しかし、医療資源の不均一な分布と診断方法の複雑さは、多くの国や地域でこの障害に不十分な注意を払っています。このペーパーでは、MDD-LLMという名前の高性能MDD診断ツールを紹介します。MDD-LLMは、MDD診断の課題に取り組むために微調整された大規模な言語モデル（LLM）と広範な現実世界のサンプルを利用するAI駆動型フレームワークです。具体的には、英国のBiobankコホートから274,348個の個別レコードを選択し、3つの表形式データ変換方法を設計して、提案された方法をトレーニングおよび評価するための大きなコーパスを作成します。MDD-LLMの利点を説明するために、包括的な実験を実行し、複数の評価メトリックにわたって既存のモデルベースのソリューションに対するいくつかの比較分析を提供します。実験結果は、MDD-LLM（70B）が0.8378の精度と0.8919（95％CI：0.8799-0.9040）のAUCを達成し、MDD診断のための既存のマシンと深い学習フレームワークを大幅に上回ることを示しています。MDD診断におけるLLMの調査が限られていることを考えると、表形式のデータ変換技術やさまざまな微調整戦略など、提案された方法のパフォーマンスに影響を与える可能性のある多くの要因を調べます。さらに、モデルの解釈可能性も分析し、MDD-LLMがその予測を説明し、対応する理由を提供する必要があります。このペーパーでは、MDDを診断するためのLLMSおよび大規模なトレーニングサンプルの適用を調査します。調査結果は、LLMS駆動型スキームが、従来のモデルベースのソリューションと比較して、MDD診断における精度、堅牢性、および解釈性の重大な可能性を提供することを示しています。"
40479778,Development and evaluation of a retrieval-augmented large language model framework for enhancing endodontic education.,2025,International journal of medical informatics,"Xu Xiaowei, Liu Siyi, Zhu Lin, Long Yunzi, Zeng Yin, Lu Xudong, Li Jiao, Dong Yanmei","Integrating domain-specific knowledge into large language models (LLMs) remains a critical challenge in medical education. In dental specialties such as endodontics, effective learning requires access to both textual clinical evidence and visual procedural demonstrations. However, generic LLMs often produce content that lacks clinical accuracy, contextual grounding, or pedagogical clarity, thereby limiting their applicability in specialized training environments. To develop and evaluate a Retrieval-Augmented Generation (RAG)-enhanced LLMs framework that addresses the challenge of integrating domain-specific knowledge in AI-driven endodontic education. We present Endodontics-KB, a multimodal knowledge integration platform that combines evidence-based dental literature (e.g., textbooks, clinical guidelines) with visual instructional materials (e.g., procedural videos) through a hierarchical RAG architecture. The system's core component, the EndoQ chatbot, utilizes LLMs augmented with multimodal dental datasets to enable context-aware clinical reasoning. Benchmarking was conducted against three general-purpose LLMs: GPT-4, Qwen2.5, and DeepSeek R1, using a structured question bank comprising 11 expert-validated endodontic questions. Two domain experts performed a blinded evaluation across five performance dimensions: clinical accuracy, contextual relevance, completeness, decision-making professionalism, and communication fluency. The framework integrated 2,200 multimodal knowledge units through dynamic semantic indexing. EndoQ demonstrated statistically significant improvements across all evaluation metrics compared to general purpose LLMs: accuracy (4.45 ± 0.96), clinical relevance (4.59 ± 0.8), completeness (4.27 ± 0.83), professionalism judgment (4.45 ± 1.06), and language fluency (4.86 ± 0.47), as measured on a 5-point Likert scale. This proposed framework improves educational outcomes through precise and context-aware knowledge delivery. Furthermore, it represents a scalable and transferable model for AI-enhanced clinical training across medical specialties, significantly advancing competency-based pedagogy in dental education.",https://pubmed.ncbi.nlm.nih.gov/40479778/,"ドメイン固有の知識を大規模な言語モデル（LLM）に統合することは、医学教育における重要な課題のままです。歯内療法などの歯科専門分野では、効果的な学習には、テキストの臨床的証拠と視覚的な手続き上のデモの両方にアクセスする必要があります。ただし、一般的なLLMは、多くの場合、臨床的精度、コンテキストの接地、または教育学的な明確さを欠くコンテンツを生成し、それにより特殊なトレーニング環境での適用性を制限します。AI駆動型の歯内療法におけるドメイン固有の知識を統合するという課題に対処する、検索された生成（RAG）強化LLMSフレームワークを開発および評価する。階層的なラグアーキテクチャを通じて、エビデンスに基づいた歯科文献（教科書、臨床ガイドラインなど）と視覚的指導資料（手続き的ビデオなど）を組み合わせたマルチモーダルナレッジ統合プラットフォームであるEndodontics-KBを紹介します。システムのコアコンポーネントであるEndoq Chatbotは、マルチモーダルの歯科データセットで拡張されたLLMSを使用して、コンテキスト対応の臨床的推論を可能にします。ベンチマークは、11の専門家で検証された歯内療法の質問を含む構造化された質問銀行を使用して、GPT-4、QWEN2.5、およびDeepSeek R1の3つの汎用LLMに対して実施されました。2人のドメインの専門家が、臨床的精度、コンテキスト関連、完全性、意思決定プロフェッショナリズム、コミュニケーションの流encyの5つのパフォーマンスの側面にわたって盲目的な評価を行いました。このフレームワークは、動的セマンティックインデックスを介して2,200マルチモーダルナレッジユニットを統合しました。ENDOQは、一般的な目的LLMS：精度（4.45±0.96）、臨床的関連（4.59±0.8）、完全性（4.27±0.83）、プロフェッショナリズムの判断（4.45±1.06）、言語の流fluency（4.86±0.47）、5ポイントの尺度としての尺度としての尺度（4.45±1.06）、および5ポイントの尺度としての統計的に有意な改善を実証しました。この提案されたフレームワークは、正確かつコンテキストを意識した知識提供を通じて教育成果を改善します。さらに、それは、医療専門分野全体でAIを強化した臨床トレーニングのためのスケーラブルで移転可能なモデルを表し、歯科教育におけるコンピテンシーベースの教育学を大幅に進めています。"
40706107,LLM-based approaches for automated vocabulary mapping between SIGTAP and OMOP CDM concepts.,2025,Artificial intelligence in medicine,"de Barros Vanzin Vinícius João, de Abreu Moreira Dilvan, Marcondes Marcacini Ricardo","In the context of global healthcare systems, integrating diverse medical terminologies and classification systems has become a priority due to the adoption of Electronic Health Record (EHR) systems and the imperative for information exchange between healthcare systems. This study addresses the necessity for mapping between the SIGTAP vocabulary used in Brazilian healthcare systems and the broader medical terms of the OMOP CDM terminologies. Two distinct pipelines are evaluated for the vocabulary mapping process, focusing on two subsets of the SIGTAP vocabulary: medicines and medical procedures. The first pipeline utilizes textual embeddings for semantic similarity evaluation, followed by Large Language Models (LLMs) for correspondences selection through a retrieval-augmented generation (RAG) approach. In the second pipeline, LLM agents employ predefined protocols for vocabulary mapping and query refinement. Our results show comparable performance between pipelines in both the Procedures subset (F<sub>1</sub> of 0.684 versus 0.678), and the Medicines subset (F<sub>1</sub> of 0.846 versus 0.839), indicating the viability of the multi-stage filtering approach. The second pipeline demonstrates an advantage over the first in terms of recall, highlighting the efficacy of dynamic query refinement by the agent. These findings provide evidence that LLM-based methods significantly reduce manual effort required by experts, enabling domain specialists to focus on more challenging cases.",https://pubmed.ncbi.nlm.nih.gov/40706107/,グローバルヘルスケアシステムのコンテキストでは、電子健康記録（EHR）システムの採用とヘルスケアシステム間の情報交換の命令により、多様な医療用語と分類システムを統合することが優先事項になりました。この研究では、ブラジルのヘルスケアシステムで使用されるSIGTAP語彙とOMOP CDM用語のより広範な医療条件との間のマッピングの必要性に取り組んでいます。語彙マッピングプロセスについては、2つの異なるパイプラインが評価され、SigTap語彙の2つのサブセット、医薬品と医療処置に焦点を当てています。最初のパイプラインは、セマンティックな類似性評価にテキスト埋め込みを利用し、その後、検索された生成（RAG）アプローチを介した対応選択のための大規模な言語モデル（LLMS）が続きます。2番目のパイプラインでは、LLMエージェントは語彙マッピングとクエリの改良のために事前定義されたプロトコルを採用しています。私たちの結果は、プロシージャサブセット（0.684対0.678のF <<sub> 1 </sub>）と、医薬品サブセット（0.846対0.839のF <sub> 1 </sub>）の両方のパイプライン間の同等のパフォーマンスを示しており、マルチステージフィルタリングアプローチの生存率を示しています。2番目のパイプラインは、エージェントによる動的クエリの改良の有効性を強調し、リコールの点で最初のパイプラインよりも利点を示しています。これらの調査結果は、LLMベースの方法が専門家が必要とする手動の努力を大幅に減らし、ドメインの専門家がより困難なケースに集中できるようにするという証拠を提供します。
40680485,Toward fair medical advice: Addressing and mitigating bias in large language model-based healthcare applications.,2025,Artificial intelligence in medicine,"Lu Haohui, Lin Ye, Li Zhidong, Yiu Man Lung, Gao Yu, Uddin Shahadat","Large Language Models (LLMs) are increasingly deployed in web-based medical advice applications, offering scalable and accessible healthcare solutions. However, their outputs often reflect demographic biases, raising concerns about fairness and equity for vulnerable populations. In this work, we propose FairMed, a framework designed to mitigate biases in LLM-generated medical advice through fine-tuning and prompt engineering strategies. We evaluate FairMed using language-based and content-level metrics across demographic groups on publicly available (MedQA), synthetic (Synthea), and private (CBHS) datasets. Experimental results demonstrate consistent improvements over Llama3 - Med42, as well as over the zero-shot prompting baseline. For instance, in sentiment analysis for gender groups using MedQA, FairMed with Descriptive Prompting reduces the Statistical Parity Difference (SPD) from 0.0902 to 0.0658, improves the Disparate Impact Ratio from 1.1916 to 1.1566, and decreases the Kullback-Leibler Divergence from 0.0045 to 0.0024. Similarly, in directive language evaluation for gender groups using Synthea, SPD improves from 0.1056 to nearly zero, achieving near-perfect parity. On the CBHS dataset, FairMed with Descriptive Prompting increases Diagnostic Recommendation Divergence (DRD) for race groups from 0.9530 to 0.9848, indicating improved group-specific tailoring, while reducing the Action Disparity Index (ADI) from 0.0857 to 0.0469 and Referral Frequency Parity (RFP) from 0.0791 to 0.0511, reflecting enhanced fairness. These findings highlight FairMed's effectiveness in addressing demographic disparities and promoting equitable healthcare guidance through web technologies. This framework contributes to building trustworthy and inclusive systems for delivering medical advice by ensuring fairness in sensitive applications.",https://pubmed.ncbi.nlm.nih.gov/40680485/,大規模な言語モデル（LLM）は、Webベースの医療アドバイスアプリケーションにますます展開されており、スケーラブルでアクセス可能なヘルスケアソリューションを提供しています。しかし、それらの生産量は多くの場合、人口統計学的偏見を反映しており、脆弱な集団の公平性と公平性に関する懸念を引き起こします。この作業では、微調整および迅速なエンジニアリング戦略を通じてLLM生成の医学的アドバイスのバイアスを緩和するように設計されたフレームワークであるFairmedを提案します。公開されている（MEDQA）、合成（シンセア）、およびプライベート（CBHS）データセットで、人口統計グループ全体で言語ベースとコンテンツレベルのメトリックを使用してフェアメッドを評価します。実験結果は、llama3 -med42およびゼロショットプロンプトベースラインよりも一貫した改善を示しています。たとえば、MEDQAを使用した性別グループの感情分析では、記述プロンプトでフェアメッドで統計的パリティの差（SPD）が0.0902から0.0658に減少し、異なる衝撃比を1.1916から1.1566に改善し、0.0045から0.0024から0.0045から0.0045から0.0045から0.0045への分岐を減少させます。同様に、Syntheaを使用した性別グループの指令言語評価では、SPDは0.1056からほぼゼロに向上し、ほぼ完璧なパリティを達成します。CBHSデータセットでは、記述プロンプトが0.9530から0.9848のレースグループの診断推奨の発散（DRD）を増加させ、グループ固有の仕立ての改善を示しながら、0.0857から0.0469から0.0469から0.0469から0.0791からの参照頻度（RFP）を反映した頻度（RFP）を削減することを示しています。これらの調査結果は、人口統計学的格差に対処し、Webテクノロジーを通じて公平なヘルスケアガイダンスを促進する際のFairmedの有効性を強調しています。このフレームワークは、デリケートなアプリケーションの公平性を確保することにより、医学的アドバイスを提供するための信頼できる包括的なシステムを構築することに貢献します。
40633400,From segmentation to explanation: Generating textual reports from MRI with LLMs.,2025,Computer methods and programs in biomedicine,"Valerio Alberto G, Trufanova Katya, de Benedictis Salvatore, Vessio Gennaro, Castellano Giovanna","Artificial Intelligence (AI) has significantly advanced medical imaging, yet the opacity of deep learning models remains challenging, often reducing the trust of medical professionals towards AI-driven diagnoses. As a result, there is a strong focus on making AI models more transparent and interpretable to boost healthcare providers' confidence in these technologies. This paper introduces a novel approach to enhance AI explainability in critical medical tasks by integrating state-of-the-art semantic segmentation models with atlas-based mapping and Large Language Models (LLMs) to produce comprehensive, human-readable medical reports. The proposed framework ensures that the generated outputs are factual and contextually rich. Our anti-hallucination design, which combines structured JSON with prompt constraints, is a critical innovation compared to most naïve LLM report generation methods, thereby enhancing the transparency and interpretability of AI systems. Experimental results show that the SegResNet model achieves high segmentation accuracy, while LLMs (Gemma, Llama, and Mistral) demonstrate diverse strengths in generating explanatory reports. Numerous metrics have been employed to assess the quality and effectiveness of generated textual explanations, such as lexical diversity, readability, coherence, and information coverage. The method has been specifically tested for brain tumor detection in glioma, one of the most aggressive forms of cancer, and subsequently applied to multiple sclerosis lesion detection to further validate its generalizability across various medical imaging scenarios, thereby contributing to the trustworthiness of healthcare AI applications. The complete source code for implementing the framework and reproducing the results is publicly available, along with full pipeline examples demonstrating each step - from segmentation to report generation - at the following repository: https://github.com/albertovalerio/from-segmentation-to-explanation.",https://pubmed.ncbi.nlm.nih.gov/40633400/,人工知能（AI）は医療イメージングを大幅に進めていますが、深い学習モデルの不透明度は挑戦的なままであり、多くの場合、AI駆動型の診断に対する医療専門家の信頼を減らします。その結果、AIモデルをより透明で解釈し、これらの技術に対する医療提供者の信頼を高めることに重点を置いています。このペーパーでは、最先端のセマンティックセグメンテーションモデルをAtlasベースのマッピングと大規模な言語モデル（LLM）と包括的で人間の読み取り可能な医療報告書を作成することにより、重要な医療タスクのAIの説明可能性を高めるための新しいアプローチを紹介します。提案されたフレームワークは、生成された出力が事実に基づいており、文脈的に豊富であることを保証します。構造化されたJSONと迅速な制約を組み合わせた当社の耐性設計は、ほとんどのナイーブLLMレポート生成方法と比較して重要な革新であり、それによりAIシステムの透明性と解釈可能性を高めます。実験結果は、SegreSnetモデルが高いセグメンテーション精度を達成し、LLMS（Gemma、Llama、およびMistral）が説明レポートを生成する際に多様な強みを示していることを示しています。語彙の多様性、読みやすさ、コヒーレンス、情報カバレッジなど、生成されたテキストの説明の品質と有効性を評価するために、多くの指標が採用されています。この方法は、癌の最も攻撃的な形態の1つである神経膠腫における脳腫瘍検出について特異的にテストされており、その後、さまざまな医療イメージングシナリオにわたる一般化可能性をさらに検証するために多発性硬化症の病変検出に適用され、それによってヘルスケアAIアプリケーションの信頼性に貢献します。フレームワークを実装し、結果を再現するための完全なソースコードは、次のリポジトリで次のリポジトリで、セグメンテーションから生成までの各ステップを示す完全なパイプラインの例とともに、公開されています。
